{
  "rule_id": "protocol.samsung_smarttag",
  "revision": 3,
  "schema_version": "1.0.0",
  "enabled": false,
  "maturity": "experimental",
  "kind": "protocol",
  "description": "DISABLED: 0x0075 with header 0x4204 matches Samsung TVs (e.g. Samsung 7 Series) and Quick Connect ecosystem devices rather than dedicated SmartTags. Samsung SmartTag tracking is exclusively handled by protocol.samsung_smarttag_fd5a.",
  "evidence_references": [
    {
      "source": "observed_excerpt",
      "description": "Observed Samsung Quick Connect broadcast from TV [TV] Samsung 7 Series (55)",
      "url_or_ref": "C:/Users/User/Desktop/BLE-airtag/pcaps/5-10-11-00/samsong.pcapng"
    }
  ],
  "output": {
    "protocol_family": "Samsung SmartThings Find",
    "brand": "Samsung",
    "model": "Galaxy SmartTag",
    "brand_source": "inferred",
    "status_text": "Samsung SmartTag / SmartThings Find offline broadcast",
    "is_candidate": true,
    "candidate_group": "protocol_match"
  },
  "conditions": {
    "all_of": [
      {
        "company_id": "0075"
      },
      {
        "payload_length_in": [
          24,
          25
        ],
        "source": "manufacturer_data"
      },
      {
        "hex_prefix": {
          "prefix": "4204",
          "source": "manufacturer_data"
        }
      }
    ]
  },
  "verification": {
    "level": "web_reference",
    "reviewed": "2026-10-12",
    "note": "Not lab verified. Legacy maturity is not a laboratory certification."
  }
}
